{
  "request_id": "req-2026-10-18-0001",
  "capability_id": "CAP-MEA-02",
  "state": {
    "candidate_id": "cand-m1-0001",
    "candidate_text": "Strands Decider 2B: typed decision model",
    "current_demand": "构建个人信息决策系统",
    "evidence_refs": [
      "store/raw/cand-m1-0001.txt#L1-L40"
    ]
  },
  "question": {
    "type": "choice",
    "instruction": "按给定标准判定候选与当前目标的关系",
    "options": [
      "DIRECT",
      "ADJACENT",
      "EXPLORATORY",
      "UNRELATED",
      "INSUFFICIENT_EVIDENCE"
    ]
  },
  "language_context": {
    "source_language": "en",
    "retrieval_languages": [
      "en"
    ],
    "judgment_language": "en",
    "input_representation": "ORIGINAL_SOURCE_TEXT",
    "delivery_language_mode": "ZH_TRANSLATION",
    "translation_ref": null
  },
  "created_at": "2026-10-18T03:30:00+08:00",
  "contract_version": "1.1"
}
